{
  "id": "CONTRACT.F1A.TRANSMISSION_RECOVERY.2026-09-21",
  "status": "PROSPECTIVE_SYNTHETIC_RECOVERY_DESIGN",
  "feedback_family": "F1a",
  "purpose": "Prospectively test whether a calibration-only stochastic transmission extension can recover a known synthetic conditional edge-transmission probability while preserving the F1a scheduler and v0.1.1 cognitive-state boundaries.",
  "baseline": {
    "public_release": "v0.1.1",
    "f1a_main_commit": "88921e63a45eff0c4be75a902ebcb8a4097ef546",
    "current_f1a_stage": "SYNTHETIC_EXECUTABLE"
  },
  "design": {
    "core_config": "model/benchmarks/f1a_transmission_recovery_core.json",
    "implementation_module": "src/cognitive_epistemic_model/calibration/f1a_transmission_recovery.py",
    "runner": "scripts/run_f1a_transmission_recovery.py",
    "result_path": "model/benchmarks/results/f1a_transmission_recovery_authoritative_2026-09-21.json",
    "active_runtime_policy_change_allowed": false,
    "result_must_not_predate_this_contract": true
  },
  "estimand": {
    "name": "q_transmit",
    "mathematical_role": "Conditional Bernoulli probability of realised transmission on one declared eligible directed edge given a realised Share.",
    "denominator": "realised Share-edge opportunities",
    "numerator": "realised endogenous recipient ExposureEvents generated by the recovery-only policy",
    "jointly_estimates_share_propensity": false,
    "empirical_interpretation_allowed": false
  },
  "rng_contract": {
    "transmission_rng_isolated_from_cognitive_rng": true,
    "deterministic_seed_derivation_required": true,
    "same_seed_reproducible": true,
    "benchmark_iteration_order_must_not_change_cell_random_streams": true
  },
  "recovery_design": {
    "estimator": "BINOMIAL_MLE",
    "q_grid": [
      0.1,
      0.25,
      0.5,
      0.75,
      0.9
    ],
    "core_opportunity_counts": [
      50,
      100
    ],
    "stress_opportunity_counts": [
      25
    ],
    "delay_factors": [
      1,
      4
    ],
    "absolute_error_tolerance": 0.1,
    "minimum_core_cell_recovery_probability": 0.8,
    "replicates_per_cell": 200,
    "stress_cells_are_non_gating": true
  },
  "structural_controls": {
    "q_zero_exact_no_transmission": true,
    "q_one_exact_full_transmission": true,
    "q_one_matches_forced_pass_through_exposure_count": true,
    "delay_changes_timing_not_complete_horizon_exposure_count": true,
    "final_familiarity_must_equal_existing_update_from_realised_exposure_count": true
  },
  "sensitivity_scope": {
    "primary_parameter": "q_transmit",
    "design_factors": [
      "opportunity_count",
      "abstract_delay"
    ],
    "expected_relations": [
      "mean exposure proportion increases with q_transmit",
      "larger opportunity count improves recovery precision without changing q_transmit",
      "abstract delay changes event timing but not expected full-horizon exposure proportion"
    ],
    "global_variance_decomposition_required": false,
    "rationale": "The first recovery design has one stochastic process parameter and two controlled design factors; a bounded grid plus explicit stress conditions is sufficient for this prospective stage."
  },
  "observability_boundary": [
    "The benchmark observes realised Share-edge opportunities and realised recipient exposures directly from synthetic provenance.",
    "This does not establish that equivalent quantities are observable in any human or platform dataset.",
    "If future empirical data do not observe the denominator and numerator separately, q_transmit may not be identifiable under this estimator."
  ],
  "promotion_gate": {
    "current_stage": "SYNTHETIC_EXECUTABLE",
    "candidate_stage_after_authoritative_pass": "RECOVERY_TESTED",
    "automatic_promotion_allowed": false,
    "core_config_frozen_before_authoritative_result": true,
    "requirements": [
      "contract_schema_valid",
      "prospective_exact_binomial_coverage_recomputed",
      "recovery_only_policy_not_imported_by_active_runtime",
      "isolated_rng_streams_verified",
      "same_seed_authoritative_result_reproducible",
      "all_core_grid_cells_meet_recovery_gate",
      "stress_results_reported_even_when_failed",
      "q_zero_control_passes",
      "q_one_control_passes",
      "delay_realization_check_passes",
      "familiarity_consistency_check_passes",
      "open_loop_and_f1a_regression_suite_green",
      "full CBD validation green"
    ]
  },
  "interpretation_boundary": [
    "A passing result is a best-case synthetic identifiability result, not evidence that the stochastic transmission mechanism is true.",
    "No parameter value in this design is a population, platform, social-network, or human estimate.",
    "RECOVERY_TESTED would remain below EMPIRICALLY_CONSTRAINED and ACTIVE on the Issue #110 validation ladder.",
    "No full endogenous Share-to-Share feedback loop or formal System Dynamics classification is implied."
  ],
  "method_basis": [
    {
      "id": "METHOD.WILSON_COLLINS.2019",
      "doi": "10.7554/eLife.49547",
      "role": "prospective parameter recovery using simulated data with known generating parameters"
    },
    {
      "id": "METHOD.THIELE_KURTH_GRIMM.2014",
      "doi": "10.18564/jasss.2503",
      "role": "structured parameter estimation and sensitivity analysis for simulation models"
    },
    {
      "id": "METHOD.TEN_BROEKE_ET_AL.2016",
      "url": "https://www.jasss.org/19/1/5.html",
      "role": "bounded sensitivity analysis starting point for limited-complexity agent-based models"
    }
  ]
}
